{
  "schemaVersion": "redaction-policy-v0",
  "policyId": "rp_v0_1_17_redaction_gate",
  "mode": "manual_offline_executable_gate_only",
  "redactionGate": "reject_sensitive_persistence",
  "defaultAction": "reject_unknown_sensitive_field",
  "sensitiveFieldClasses": [
    "raw_content",
    "secret_like_value",
    "private_path",
    "tool_output",
    "memory_text",
    "config_text",
    "approval_text",
    "long_raw_prompt",
    "unknown_sensitive_field"
  ],
  "requiredOutputFlags": [
    "rawPersisted",
    "secretLikePersisted",
    "privatePathPersisted",
    "toolOutputPersisted",
    "memoryTextPersisted",
    "configTextPersisted",
    "approvalTextPersisted"
  ],
  "rawContentPersisted": false,
  "secretLikePersisted": false,
  "privatePathPersisted": false,
  "toolOutputPersisted": false,
  "memoryTextPersisted": false,
  "configTextPersisted": false,
  "approvalTextPersisted": false,
  "longRawPromptPersisted": false,
  "unknownSensitiveFieldPersisted": false,
  "boundary": [
    "manual_offline_only",
    "already_redacted_or_placeholder_fixtures_only",
    "reject_only_redaction_gate",
    "raw_content_not_persisted",
    "secret_like_values_not_persisted",
    "private_paths_not_persisted",
    "tool_outputs_not_persisted",
    "memory_text_not_persisted",
    "config_text_not_persisted",
    "approval_text_not_persisted",
    "long_raw_prompt_not_persisted",
    "unknown_sensitive_fields_rejected",
    "no_live_observation",
    "no_runtime",
    "no_daemon",
    "no_watcher",
    "no_adapter_integration",
    "no_tool_execution",
    "no_memory_write",
    "no_config_write",
    "no_external_publication",
    "no_approval_path",
    "no_blocking",
    "no_allowing",
    "no_authorization",
    "no_enforcement"
  ]
}
